{
  "nodeId": "root node id",
  "nodeName": "root node name",
  "gameObjectCategory": "container",
  "gameObjectName": "a meaningful and descriptive name",
  "isButton": false,
  "horizontal_alignment": "center",
  "vertical_alignment": "center",
  "children": [
    {
      "nodeId": "node id",
      "nodeName": "node name",
      "gameObjectCategory": "image",
      "gameObjectName": "a meaningful and descriptive name",
      "isButton": false,
      "image_type": "simple",
      "horizontal_alignment": "center",
      "vertical_alignment": "center",
      "children": []
    },
    {
      "nodeId": "node id",
      "nodeName": "node name",
      "gameObjectCategory": "image",
      "gameObjectName": "a meaningful and descriptive name",
      "isButton": false,
      "image_type": "sliced",
      "horizontal_alignment": "center",
      "vertical_alignment": "center",
      "children": [
        {
          "nodeId": "node id",
          "nodeName": "node name",
          "gameObjectCategory": "text",
          "gameObjectName": "a meaningful and descriptive name",
          "isButton": false,
          "horizontal_alignment": "center",
          "vertical_alignment": "center",
          "children": []
        }
      ]
    },
    {
      "nodeId": "node id",
      "nodeName": "node name",
      "gameObjectCategory": "container",
      "gameObjectName": "a meaningful and descriptive name",
      "isButton": true,
      "horizontal_alignment": "center",
      "vertical_alignment": "bottom",
      "children": [
        {
          "nodeId": "node id",
          "nodeName": "node name",
          "gameObjectCategory": "image",
          "gameObjectName": "a meaningful and descriptive name",
          "isButton": false,
          "image_type": "tiled",
          "horizontal_alignment": "center",
          "vertical_alignment": "center",
          "children": []
        },
        {
          "nodeId": "node id",
          "nodeName": "node name",
          "gameObjectCategory": "text",
          "gameObjectName": "a meaningful and descriptive name",
          "isButton": false,
          "horizontal_alignment": "center",
          "vertical_alignment": "center",
          "children": []
        }
      ]
    }
  ]
}
